{
  "$schema": "https://adjective.us/prelude/schemas/v1/map.schema.json",
  "version": "1.0.0",
  "stats": {
    "files": 84,
    "modules": 11,
    "edges": 244,
    "unresolvedImports": 7
  },
  "modules": [
    {
      "path": ".",
      "fileCount": 1,
      "files": [
        {
          "file": "eslint.config.js",
          "lang": "js",
          "lines": 28
        }
      ]
    },
    {
      "path": "bench",
      "purpose": "Retrieval benchmark for prelude locate",
      "fileCount": 1,
      "files": [
        {
          "file": "bench/locate-bench.ts",
          "lang": "ts",
          "lines": 227,
          "imports": [
            "src/core/locate.ts",
            "src/core/map-scanner.ts",
            "src/core/source-scanner.ts"
          ]
        }
      ],
      "dependsOn": [
        "src/core"
      ]
    },
    {
      "path": "bin",
      "purpose": "Executable entry points",
      "fileCount": 1,
      "files": [
        {
          "file": "bin/prelude.ts",
          "lang": "ts",
          "lines": 59,
          "imports": [
            "src/commands/annotate.ts",
            "src/commands/compact.ts",
            "src/commands/decision.ts",
            "src/commands/diff.ts",
            "src/commands/export.ts",
            "src/commands/history.ts",
            "src/commands/hook.ts",
            "src/commands/init.ts",
            "src/commands/locate.ts",
            "src/commands/mcp-config.ts",
            "src/commands/query.ts",
            "src/commands/serve.ts",
            "src/commands/share.ts",
            "src/commands/update.ts",
            "src/commands/validate.ts",
            "src/commands/watch.ts",
            "src/commands/workspace.ts",
            "src/utils/version.ts"
          ],
          "rank": 0.5,
          "role": "CLI entry point"
        }
      ],
      "dependsOn": [
        "src/commands",
        "src/utils"
      ]
    },
    {
      "path": "src",
      "fileCount": 1,
      "files": [
        {
          "file": "src/constants.ts",
          "lang": "ts",
          "lines": 62,
          "exports": [
            "CONTEXT_DIR",
            "CONTEXT_FILES",
            "WATCH_PATTERNS",
            "IGNORE_PATTERNS"
          ],
          "importedBy": 17,
          "rank": 0.65
        }
      ],
      "dependedOnBy": [
        "src/commands",
        "src/core",
        "src/mcp",
        "src/runtime"
      ],
      "tests": [
        "tests/diff.test.ts",
        "tests/export-formats.test.ts",
        "tests/init.test.ts"
      ]
    },
    {
      "path": "src/commands",
      "purpose": "Command handlers",
      "fileCount": 17,
      "files": [
        {
          "file": "src/commands/annotate.ts",
          "lang": "ts",
          "lines": 29,
          "exports": [
            "registerAnnotateCommand"
          ],
          "imports": [
            "src/core/map-annotate.ts",
            "src/runtime/context.ts",
            "src/utils/log.ts"
          ],
          "importedBy": 1,
          "rank": 0.04
        },
        {
          "file": "src/commands/compact.ts",
          "lang": "ts",
          "lines": 40,
          "exports": [
            "registerCompactCommand"
          ],
          "imports": [
            "src/core/compact.ts",
            "src/runtime/context.ts",
            "src/utils/fs.ts",
            "src/utils/log.ts"
          ],
          "importedBy": 1,
          "rank": 0.04
        },
        {
          "file": "src/commands/decision.ts",
          "lang": "ts",
          "lines": 60,
          "exports": [
            "registerDecisionCommand"
          ],
          "imports": [
            "src/core/decisions.ts",
            "src/runtime/context.ts",
            "src/schema/index.ts",
            "src/utils/fs.ts",
            "src/utils/log.ts"
          ],
          "importedBy": 1,
          "rank": 0.04
        },
        {
          "file": "src/commands/diff.ts",
          "lang": "ts",
          "lines": 57,
          "exports": [
            "DiffJson",
            "formatDiffJson",
            "formatDiffSummary",
            "registerDiffCommand"
          ],
          "imports": [
            "src/core/diff.ts",
            "src/runtime/context.ts",
            "src/utils/fs.ts",
            "src/utils/log.ts"
          ],
          "importedBy": 1,
          "rank": 0.04
        },
        {
          "file": "src/commands/export.ts",
          "lang": "ts",
          "lines": 87,
          "exports": [
            "registerExportCommand"
          ],
          "imports": [
            "src/core/exporter.ts",
            "src/runtime/context.ts",
            "src/utils/clipboard.ts",
            "src/utils/fs.ts",
            "src/utils/log.ts"
          ],
          "importedBy": 1,
          "rank": 0.04
        },
        {
          "file": "src/commands/history.ts",
          "lang": "ts",
          "lines": 32,
          "exports": [
            "registerHistoryCommand"
          ],
          "imports": [
            "src/core/history.ts",
            "src/core/state-manager.ts",
            "src/runtime/context.ts",
            "src/utils/fs.ts",
            "src/utils/log.ts"
          ],
          "importedBy": 1,
          "rank": 0.04
        },
        {
          "file": "src/commands/hook.ts",
          "lang": "ts",
          "lines": 32,
          "exports": [
            "registerHookCommand"
          ],
          "imports": [
            "src/core/git-hook.ts",
            "src/utils/log.ts"
          ],
          "importedBy": 1,
          "rank": 0.04
        },
        {
          "file": "src/commands/init.ts",
          "lang": "ts",
          "lines": 295,
          "exports": [
            "registerInitCommand",
            "InitOptions",
            "initContext"
          ],
          "imports": [
            "src/commands/workspace.ts",
            "src/constants.ts",
            "src/core/claude-md-parser.ts",
            "src/core/infer.ts",
            "src/core/map-scanner.ts",
            "src/core/merger.ts",
            "src/core/state-manager.ts",
            "src/runtime/context.ts",
            "src/schema/index.ts",
            "src/utils/fs.ts",
            "src/utils/log.ts"
          ],
          "importedBy": 1,
          "rank": 0.04
        },
        {
          "file": "src/commands/locate.ts",
          "lang": "ts",
          "lines": 44,
          "exports": [
            "registerLocateCommand"
          ],
          "imports": [
            "src/core/locate.ts",
            "src/utils/log.ts"
          ],
          "importedBy": 1,
          "rank": 0.04
        },
        {
          "file": "src/commands/mcp-config.ts",
          "lang": "ts",
          "lines": 96,
          "exports": [
            "renderMcpConfig",
            "registerMcpConfigCommand"
          ],
          "importedBy": 1,
          "rank": 0.04
        },
        {
          "file": "src/commands/query.ts",
          "lang": "ts",
          "lines": 73,
          "exports": [
            "registerQueryCommand"
          ],
          "imports": [
            "src/core/query-engine.ts",
            "src/runtime/context.ts",
            "src/utils/fs.ts",
            "src/utils/log.ts"
          ],
          "importedBy": 1,
          "rank": 0.04
        },
        {
          "file": "src/commands/serve.ts",
          "lang": "ts",
          "lines": 37,
          "exports": [
            "registerServeCommand"
          ],
          "imports": [
            "src/core/workspace.ts",
            "src/mcp/server.ts",
            "src/runtime/context.ts",
            "src/utils/fs.ts"
          ],
          "importedBy": 1,
          "rank": 0.04
        },
        {
          "file": "src/commands/share.ts",
          "lang": "ts",
          "lines": 82,
          "exports": [
            "registerShareCommand"
          ],
          "imports": [
            "src/constants.ts",
            "src/core/exporter.ts",
            "src/runtime/context.ts",
            "src/utils/clipboard.ts",
            "src/utils/fs.ts",
            "src/utils/log.ts"
          ],
          "importedBy": 1,
          "rank": 0.04
        },
        {
          "file": "src/commands/update.ts",
          "lang": "ts",
          "lines": 161,
          "exports": [
            "UpdateOptions",
            "update"
          ],
          "imports": [
            "src/commands/workspace.ts",
            "src/constants.ts",
            "src/core/diff.ts",
            "src/core/merger.ts",
            "src/core/state-manager.ts",
            "src/runtime/context.ts",
            "src/utils/fs.ts",
            "src/utils/log.ts"
          ],
          "importedBy": 1,
          "rank": 0.04
        },
        {
          "file": "src/commands/validate.ts",
          "lang": "ts",
          "lines": 246,
          "exports": [
            "ValidationError",
            "validateAgainstSchema",
            "FileValidationResult",
            "validateContextDir",
            "registerValidateCommand"
          ],
          "imports": [
            "src/constants.ts",
            "src/runtime/context.ts",
            "src/utils/fs.ts",
            "src/utils/log.ts"
          ],
          "importedBy": 1,
          "rank": 0.04
        },
        {
          "file": "src/commands/watch.ts",
          "lang": "ts",
          "lines": 69,
          "exports": [
            "registerWatchCommand"
          ],
          "imports": [
            "src/core/watcher.ts",
            "src/runtime/context.ts",
            "src/utils/fs.ts",
            "src/utils/log.ts"
          ],
          "importedBy": 1,
          "rank": 0.04
        },
        {
          "file": "src/commands/workspace.ts",
          "lang": "ts",
          "lines": 120,
          "exports": [
            "formatProjectListLine",
            "printWorkspaceHint",
            "registerWorkspaceCommands"
          ],